review_id,asin,title,rating,date,reviewer_name,verified_purchase,body,helpful_count,crawl_date
customer_review-R2DIZ4O3A34BKY,B0CTC25796,"Brighten and Revive with Beauty of Joseon Revive Eye Serum!""",5.0,"March 9, 2025",Ally smith,1,"I recently started using the Beauty of Joseon Revive Eye Serum, and I am absolutely thrilled with the results! With a solid 4.3-star rating and over 8,500 reviews, this eye treatment serum has quickly become a staple in my skincare routine.

This serum combines retinal and niacinamide, two powerful ingredients that work wonders for puffiness, dark circles, and fine lines. After just a few weeks of use, I've noticed a significant reduction in the appearance of my under-eye bags and an overall brightening effect. My fine lines have also started to look less pronounced, which is a huge confidence booster!

The lightweight formula absorbs quickly into the skin, making it easy to layer under other products. I’ve been using it both in the morning and at night, and it plays nicely with my other skincare products, including moisturizers and sunscreens. Just be sure to apply it gently and allow it to absorb before layering on additional products.

The packaging is sleek and convenient, with a dropper that allows for precise application. A little goes a long way, so the 30ml size is quite generous and will last for a while.

Overall, I highly recommend the Beauty of Joseon Revive Eye Serum to anyone looking to combat puffiness and dark circles while improving the overall texture around the eyes. It’s effective, easy to use, and a fantastic addition to my skincare routine.",24,2025-04-15 12:21:17
customer_review-R3HO73O51UE39,B0CTC25796,Beauty of Joseon Eye Cream – A Miracle for Tired Eyes!,5.0,"February 16, 2025",Siarah,1,"If you’re looking for an eye cream that works instantly, the Beauty of Joseon Revive Eye Serum is a total game-changer! The moment you apply it, you can feel it hydrating and refreshing your under-eye area. And the best part? In just 10 minutes, your eye bags are visibly reduced, making you look well-rested and bright-eyed—even if you just woke up.

The formula is lightweight yet super nourishing, absorbing quickly without feeling greasy. It smooths, depuffs, and revitalizes tired eyes, making it perfect for anyone who struggles with dark circles or puffiness. If you need a quick fix for dull, tired eyes, this eye cream works absolute wonders!",29,2025-04-15 12:21:17
customer_review-R390NYNKID6EN9,B0CTC25796,"Great for Wrinkles, Color Correction Good but Tone-Specific",4.0,"February 15, 2025",Jae,1,"My last eye cream wasn't cutting it, so I decided to give this one a try. I'm really glad I did. Within the first week, I noticed a significant reduction in the fine wrinkles around my eyes - something my old Mizon eye cream never did. After that initial improvement, it didn't seem to do much more, but that was still a big win. The color correction aspect was a bit off for my skin tone, so I have to use it sparingly during the day, but it was surprisingly effective at reducing redness. Plus, it feels nice on the skin and doesn't have any strong scent.",21,2025-04-15 12:21:18
customer_review-RAHP8EJMNJEMD,B0CTC25796,"“Gentle, Hydrating, and Brightening: A Must-Have for Tired Eyes!”",5.0,"August 24, 2024",Tisha,1,"Texture and Application: The Beauty of Joseon Revive Eye Serum has a lightweight, silky texture that absorbs quickly into the skin. It’s non-greasy and layers well under makeup, making it a great addition to both morning and nighttime skincare routines. The serum comes with a dropper applicator, which makes it easy to dispense just the right amount without any wastage.

Hydration and Comfort: One of the standout features of this eye serum is its hydrating power. It instantly soothes and moisturizes the delicate skin around the eyes, reducing the appearance of dryness and fine lines. The formula feels refreshing upon application and leaves the skin feeling soft and supple throughout the day.

Ingredients and Benefits: The serum is packed with nourishing ingredients like ginseng extract and retinal, which are known for their anti-aging and brightening properties. Over time, I’ve noticed a visible reduction in dark circles and puffiness, and the skin around my eyes looks brighter and more rejuvenated. The gentle formula is perfect for sensitive skin and doesn’t cause any irritation, which is a huge plus.

Packaging: The packaging is simple yet elegant, with a sturdy glass bottle that feels luxurious. The dropper applicator is hygienic and easy to use, ensuring you can control the amount of product you apply. The size of the bottle is also generous for an eye serum, making it a good value for the price.

Longevity: A little goes a long way with this serum. Just a small amount is enough to cover both eyes, meaning the bottle will last for several months even with daily use. The effects of the serum also seem to improve with consistent use, making it a worthwhile investment for long-term eye care.

Value for Money: Given the quality of the ingredients and the noticeable results, the Beauty of Joseon Revive Eye Serum offers excellent value for money. It’s priced reasonably for the benefits it delivers, making it accessible for those looking to add a high-quality eye serum to their skincare routine.

Conclusion: The Beauty of Joseon Revive Eye Serum is a fantastic product that delivers on its promises of hydration, brightening, and anti-aging. Its gentle yet effective formula makes it suitable for all skin types, and the results speak for themselves. If you’re looking for an eye serum that can tackle dark circles, fine lines, and puffiness, this one is definitely worth trying. Highly recommended for anyone looking to revive and refresh their eye area!",98,2025-04-15 12:21:18
customer_review-R33NI6G51LS2NS,B0CTC25796,Feels moisturizing,5.0,"April 5, 2025",kristy wilson,1,"So moisturizing, good price, does help puffiness some in the morning. Nice creamy consistency and blends easily under concealer. I will buy again",0,2025-04-15 12:21:18
customer_review-R26S5V64WD558J,B0CTC25796,"Lightweight Hydration, But Limited Results for Stubborn Under-Eye Concerns",3.0,"October 29, 2024",Philly,1,"The Beauty of Joseon Revive Eye Serum with retinal and niacinamide is a gentle, soothing eye serum that feels luxurious on the skin, but it may fall short in delivering noticeable results for those looking to reduce puffiness, fine lines, or dark circles. The lightweight formula absorbs quickly, leaving the under-eye area feeling hydrated and smooth, which is a nice start to any skincare routine.

While it’s comfortable to apply and offers hydration and mild soothing benefits, it doesn’t seem to provide the targeted effects one might hope for, especially for more stubborn issues like dark circles or deeper wrinkles. The retinal and niacinamide combination is promising, but the results may be subtle and require longer-term use to see any real improvements in tone or texture.

This serum is well-suited for those looking for a light, hydrating eye serum, but if you’re after significant correction for fine lines, puffiness, or dark circles, it might not be potent enough. Overall, it’s a pleasant addition to a routine for extra hydration, though the results may be too minimal for those expecting a more transformative effect.",179,2025-04-15 12:21:18
customer_review-RPH4LE85S5PAD,B0CTC25796,Amazing results,5.0,"February 21, 2025",JK,1,"I've noticed a visible difference in my puffy under-eye bags since using the Beauty of Joseon Revive Eye Serum. The lightweight formula absorbs quickly and doesn't irritate my sensitive skin. I appreciate the combination of retinal and niacinamide, which seem to be effectively targeting my fine lines and dark circles. While results aren't dramatic overnight, consistent use has definitely improved the overall appearance of my eye area. This serum has become a staple in my skincare routine.",17,2025-04-15 12:21:18
customer_review-R2JKY2RQ0S4F1E,B0CTC25796,Finicky but miraculous,4.0,"January 29, 2025",Tanni Ahmed,1,"This stuff WORKS. However, it needs to be prepared and applied correctly or it’s useless. You HAVE to start with a completely clean, untouched base (if I use any kind of eye cream or moisturizer underneath it, it doesn’t do a darn thing.) But they do warn you about that in the instructions so it’s to be expected. I cleanse, then use a gentle toner (it MUST be oil-free) under the eyes and let it dry completely before applying.

You then have to apply JUST the right amount (trial and error, but I’ve found that about a pea size dot is enough for both eyes), and start by gently swiping on the area and THEN patting. When I start out by just patting, it doesn’t work as well. And do NOT get it right underneath the eyes.. it will be crepe-city. This is designed to reduce bags, not fine lines. When I get it too close under my eyes where I have lines I'm horrified. It also definitely feels weird and tight but that’s to be expected.

After applying, I’ve found that putting ANY kind of liquid/cream product on top of it (concealer, foundation, moisturizer) completely negates its effects. They say in the instructions that any kind of oil breaks down the tightening qualities and it’s true. So if you want to put makeup on top, it’s best to use some sort of lightweight powder. It does have a tint to it so I haven’t found the need for concealer when I’m wearing it.

It definitely is fussy and finicky BUT it works so well I don’t mind. If you read the instructions they are very straightforward about how particular you have to be to get good results, so it’s not like they’re trying to trick you. Now that I’ve practiced with it a bunch, I’ll never be without it. I won’t use it every day because I do like to put eye cream on in the morning and can’t do that with this, so I save it for special occasions or extra-puffy days. It’s expensive but worth it for those days.",52,2025-04-15 12:21:18
customer_review-R2RJNMH4F0TFV9,B0CTC25796,Good product! Just wish there was more product,5.0,"April 11, 2025",Jen,1,"Love this eye cream, I’ve genuinely noticed a difference in my eye bags since I started using it daily just over a week ago. My only wish is that there was actually more product in the tube itself. It almost looked a bit deflated when I first got it. Other than that, it’s a really good cream, definitely recommend.",0,2025-04-15 12:21:18
customer_review-R2UC9WC3BFEYOS,B0CTC25796,"Nice eye cream and doesn't irritate my dry, sensitive eyes",4.0,"February 9, 2025",R. Raymond,1,"So far so good. I don't think I have been using this long enough to speak to the effects of the retinal on fine lines, but what I do like is that it is a nice retinal eye cream that doesn't irritate my dry, sensitive eyes. I have to be very careful what I put near my eyes as many products cause eye irritation. Of course, I don't slather it all over my eyelids but I am able to use it under my eyes before bed and I haven't really had any issues with sensitivity. I will say that I also use tretinoin on my face at night (avoiding the eye area) and my skin does ok with retinoids so I would be careful if you are sensitive to retionoids as the eye area is quite delicate.",0,2025-04-15 12:21:18
customer_review-R2X7W3A5151JR8,B0CTC25796,It works!,5.0,"March 23, 2025",Susan Hunter,1,I don’t write very many reviews. I have what I think are big eye bags. I have been using this product since I purchased it once a day. I use castor oil on my face daily. I put the castor oil on first so my eye area does not get dry from the retinol and then use this product. I can see the biggest difference today when I was applying it. This really works. It takes a while but it works!,0,2025-04-15 12:21:21
customer_review-R3I1DVFSILSC0M,B0CTC25796,fair,4.0,"April 6, 2025",Gular Mammadova,1,it looks like a nice creme but still not sure about the effect. but it looks like it will work in the long run,0,2025-04-15 12:21:21
customer_review-RU44WKDMJJRNL,B0CTC25796,I love this profuct,5.0,"March 31, 2025",Diana VQ,1,"I really like this eye cream, a little tiny dot the size of a ladybug is all you need and if you are clumsy like me and get it in the eye by mistake it doesnt matter because you wont feel it. Not like other creams that will be very uncomfortable if they get close the eye or eye area.",0,2025-04-15 12:21:21
customer_review-RFIKB7WM9A6K0,B0CTC25796,Amazing stuff!,5.0,"March 25, 2025",Amazon Customer,1,I rarely write reviews for skincare because I have such a hard time finding things that actually work for my sensitive dry skin but this eye cream has been amazing at combatting my dry puffy under eye area. I highly recommend even just to try it out. Plus I was very surprised at how big the tube was. I have used ROC and it’s probably double the size.,0,2025-04-15 12:21:21
customer_review-R3V1ZWKLA8RSAN,B0CTC25796,nice moisturizer for eye area,4.0,"March 12, 2025",D. Coslett,1,"I'm not sure if I can tell the difference when it comes to lifting/tightening/plumping the skin under my eyes, but I do know that the skin around my eyes feels very soft and moisturized after using! It's easy to use, and a little goes a long way. Maybe I will see more results once I finish the tube!",0,2025-04-15 12:21:21
customer_review-R18CNO5KWW32TW,B0CTC25796,Not bad,4.0,"April 10, 2025",Ivan,1,Not bad,0,2025-04-15 12:21:21
customer_review-R36FO91VIFYT1J,B0CTC25796,Great product,5.0,"March 31, 2025",ric,1,"This cream was recommended to me by one of my of my friends that is a dermatologist, and I am in love! My under eye area improved significantly and the concealer looks so much better now. I love the texture! I would buy it again.",0,2025-04-15 12:21:21
customer_review-R3VSMQJH5RAVBP,B0CTC25796,La veo buena pero no una maravilla,4.0,"April 7, 2025",Ana Cristina Martinez,1,La veo buena pero no una maravilla,0,2025-04-15 12:21:21
customer_review-R1X2NP673DPG5J,B0CTC25796,It works!,5.0,"April 11, 2025",Lemon,1,"Good price and good service for sensitive skin
2% retinal works very well. I see the good results.
Also it’s very convenient to buy on Amazon.",0,2025-04-15 12:21:21
customer_review-R1NFNGOPDREMTY,B0CTC25796,Buena crema multiuso,5.0,"March 15, 2025",Idalee,1,"Excelente producto, deja la cara suave , el olor es un poco fuerte pero hace el trabajo. Luego, de par de días deja uso se ve una gran diferencia en el oscurecimiento de la ojera. Yo la uso luego de la crema, me coloco el producto y luego pongo más crema y me ha venido súper bien. Y nunca he sido fan de la crema para ojos pero esta ha funcionado bien.",0,2025-04-15 12:21:22
customer_review-R1GV99UTJKUOFT,B0CTC25796,Great for price,5.0,"April 1, 2025",eleni papachatzis,1,This eye cream definitely works! I unfortunately did not take before and agrees but have noticed less dark puffy circles especially in the morning while using this every day. Formula is also very cooling and good for sensitive skin.,0,2025-04-15 12:21:24
customer_review-RCSCS3NKQUDOD,B0CTC25796,Would buy again,4.0,"February 23, 2025",Hannah Abbiehl,1,"Still unsure about if it is helping my under eye area enough to have 5 stars. I have been using it consistently 1-2 a day. It doesn’t dry out my under eye as much as most creams with similar purpose, it’s also light weight and cheaper than most eye creams. I think it does brighten the area a little but doesn’t last long. Overall, would buy again.",0,2025-04-15 12:21:24
customer_review-R3DLPJDKS1OKTR,B0CTC25796,Sensitive skin approved,4.0,"March 3, 2025",Rachael beers,1,"So far so good. I've used the product only 3 times now, twice in the morning after washing my face and once before bed after my shower. I have sensitive skin and have not had any irritation. The lotion is light weight, non greasy with a little going a long way.",0,2025-04-15 12:21:24
customer_review-R2X378G0RQC0YQ,B0CTC25796,Love This!!!,5.0,"March 5, 2025",Kentucky_apple,1,"I absolutely love this product, Beauty of Joseon Revive Eye Serum with Retinal Niacinamide Correction for Puffy Eye Bags Fine Lines Dark Circles Wrinkles, Korean Skin Care 30ml, 1 fl.oz, 2 Packs , I had some really deep crows feet and wrinkles around my eyes. I have been using this product sine December 2024 and have a noticeable difference in those wrinkles. They have significantly diminished in depth and I love it. I would recommend this product to anyone who has concerns about their eye area wrinkles.",0,2025-04-15 12:21:24
customer_review-R2RYRI4URFU87K,B0CTC25796,Good product,5.0,"April 10, 2025",Zenah,1,Have had dark circles for the l9ngest time. So glad I found this. My eyes love it,0,2025-04-15 12:21:24
customer_review-RZM2C1RICTPNV,B0CTC25796,Nice simple eye cream,4.0,"March 8, 2025",Erin421,1,I really like this eye cream. The tube is deceiving as it looks rather large. Be sure you are pumping it out correctly. Just ok might or might not purchase again due to packaging,0,2025-04-15 12:21:24
customer_review-R35DAXFHT7KJ5J,B0CTC25796,Use on my entire face,5.0,"April 9, 2025",Farisa Seonaraine,1,Use it on my entire face because it's not irritating for me...it brightened my complexion a bit also...,0,2025-04-15 12:21:24
customer_review-R29K33GZ4FNAER,B0CTC25796,Amoo,5.0,"April 11, 2025",Vanessa Leon,1,Me gusta me hidrata muy bien las ojeras y funciona con mi corrector 🥰,0,2025-04-15 12:21:24
customer_review-R2HVE76G59KQA0,B0CTC25796,One week miracle,5.0,"March 2, 2025",APB,1,I can already see the dark circles going away in a week but the puffiness is still there. Nothing has ever ever ever worked on my pigmented dark circles and this works. I saw a TT promo about it. I’m going to keep working on puffy issue but I am amazed that dark circles have faded. You have to know what kind of dark circles you have and why they are there and mine are called pigmented. This is what works for pigmented dark circles.,0,2025-04-15 12:21:24
customer_review-R28MSQ9HGWG6BQ,B0CTC25796,Excellent skin care product.,5.0,"April 1, 2025",Marina Popel,1,"A good serum for aging skin with retinal. Easy to apply, pleasant smell. After applying the serum, the skin under the eyes becomes soft and nourished. I really like it.",2,2025-04-15 12:21:24
customer_review-R39LIASJQU9BAB,B0CTC25796,Good Eye Cream,4.0,"March 2, 2025",ERIKA,1,"Brings hydration, & I’ve also seen a lot of brightness. Doesn’t irritate my eye area either. I love the price point as well!",0,2025-04-15 12:21:26
customer_review-R2PTW1AGRX1JQV,B0CTC25796,Wrinkles Killer,5.0,"April 3, 2025",Rachid Echchad,1,"Leaves the face wrinkles free and the skin bright and smooth.
5/5 product for me.",0,2025-04-15 12:21:26
customer_review-R27FFUZBBACT53,B0CTC25796,Try it!,5.0,"March 26, 2025",Mamabear,1,"Wow. My eyes have dark circles and bags. It's an instant lift and makes me look younger. I've bought a lot of products, this is amazing.",0,2025-04-15 12:21:26
customer_review-RVNWVIGXV8XH8,B0CTC25796,I like this product!,5.0,"March 25, 2025",RubysMom,1,"It has made a big improvement in skin brightness around my eyes. Texture is very luxurious, no real scent that is noticeable. Im pleased with the product.",0,2025-04-15 12:21:26
customer_review-R3QCVN2PGR3KRJ,B0CTC25796,Impressed with one use!,5.0,"March 10, 2025",lasergirl,1,Okay just trying this product for the first time tonight. But I have to say I love how it really brightens up my eyes you just need a little bit dabbed underneath your eyes and in the crow's feet and it really really hydrates and just glows. Love it so far,0,2025-04-15 12:21:26
customer_review-R3L9X6A3U72O3U,B0CTC25796,super!!!,5.0,"April 7, 2025",Mauricio,1,"super producto, depues de 3 meses, se ven cambios notables.",0,2025-04-15 12:21:26
customer_review-R29BFKQ9D8FLU9,B0CTC25796,*CAUTION* Start Slow!!!,3.0,"March 14, 2025",Hannah Taylor,1,"I was super excited to use this product because of all the rave reviews so I started right off the bat applying it every day. After about a week of use I have had to stop because I’ve developed a retinol burn under one of my eyes. If you are not familiar with Retinol/Retinal products, it is recommended to start slow with only 2–3x per week use until your skin builds up a tolerance. I (ignorantly) assumed because I already regularly use Tretinoin that my skin would tolerate this well and not have an issue. Can’t speak to the long term efficacy of the product yet but I will try again with more caution once my eye heals. If you are considering this product, BE PATIENT! Start with only a few applications per week and preferably apply at night as your skin might also be more sensitive to UV damage when using. On nights when not using, be sure to moisturize and help support your skin barrier while you’re still adjusting.",18,2025-04-15 12:21:27
customer_review-RQRJ7BOVM188G,B0CTC25796,literally gives my face life every day,5.0,"March 25, 2025",wavey,1,its great - the texture and it works really good to help my eye area to feel like its living again,0,2025-04-15 12:21:27
customer_review-R51VXIB3KGWE0,B0CTC25796,Great Hydration,4.0,"March 2, 2025",Cindy L.,1,Been using for a while and I like the results,0,2025-04-15 12:21:27
customer_review-R33NU7T46N9WJ1,B0CTC25796,This brand is worth it.,5.0,"February 24, 2025",Kaylee,1,"So far I really just enjoy this brand, I’ve tried so many known American facial brands and nothing ever worked and honestly broke out my face more. But this product works well with my combination skin, my face is dry in some areas but oily and other and it really helps both. And I have terrible bags from working overnights a lot and it’s slowly getting better and I haven’t been using it long",0,2025-04-15 12:21:27
customer_review-R1ER4KZWCPY2K6,B0CTC25796,La recomiendo,5.0,"March 31, 2025",Ana de la Cruz,1,Esto el muy bueno para las hojeará me a ayudado bastante lo recomiendo al 100%,0,2025-04-15 12:21:29
customer_review-R3944R0XDMXX3Y,B0CTC25796,"Softer skin, light consistency",4.0,"November 25, 2024",Gina,1,"First of all, I wish this eye cream had a bit of shimmer to it. I used to use an eye cream that had a bit of shimmer that reflected the light to 'hide' my dark circles not help them. I don't feel this eye serum has helped too much with my dark circles but there is some change. The overall texture of around my eyes is much softer, the wrinkles that I have are less noticeable.

Secondly, because my previous eye cream was was a heavier consistency, I used too much with the first application. One pump for both eyes is enough for me. The eye serum is light weight with little to no fragrance. I dab between my 2 ring fingers and apply under my eyes and on my eye lids in a light swiping and tapping motion.

Lastly, there was no irritational from this eye serum. It has been gentle on my skin and very complimentary to another K-Beauty brands products that I use. I will continue using this product for the foreseeable future.",198,2025-04-15 12:21:29
customer_review-R2IHIV7SIETAIM,B0CTC25796,Lo mejor,5.0,"April 7, 2025",Yudelka Abreu,1,Muy bueno lo recomiendo 100%,0,2025-04-15 12:21:30
customer_review-R2GDVDLW68FDVD,B0CTC25796,Ligero e hidratante,4.0,"March 5, 2025",Niobe10,1,,3,2025-04-15 12:21:30
customer_review-R62J2M2POUP7Q,B0CTC25796,Good,5.0,"April 6, 2025",Jadieca,1,No puffiness,0,2025-04-15 12:21:30
customer_review-R229718ZM5ZHTE,B0CTC25796,Love it,5.0,"April 3, 2025",Sherri,1,Awesome product and seller!,0,2025-04-15 12:21:30
customer_review-R35ERFLA5MCK4O,B0CTC25796,Feels Nice…. No burn,5.0,"March 17, 2025",Janet R.,1,My hair stylist recommended this and I trust him! It feels nice under the eyes. I haven’t had it long enough to give results!,0,2025-04-15 12:21:30
customer_review-R2UG30YOCIVUGC,B0CTC25796,Quality and results,5.0,"March 31, 2025",Orlando,1,I was pretty satisfied girls buy it,0,2025-04-15 12:21:30
customer_review-RWEZOEC76CVGG,B0CTC25796,Yes! This is the one.,5.0,"March 21, 2025",Anne Baylor,1,The transformation after application is noticeable. Perfectly hydrated and smoothed under eye from a serum? Yes please. I’ll definitely purchase again.,0,2025-04-15 12:21:30
customer_review-RLMNCGXQD6MJS,B0CTC25796,Great with consistent use!,4.0,"January 24, 2025",Mansi Peesapati,1,"I can definitely notice a difference in my dark circles when I use this product consistently, every night. After a while I switched to every other night and it still holds up! Feels like it tightens the under eye skin a bit and shadows don’t form around them as much. Worth the price!",0,2025-04-15 12:21:30
customer_review-RKRDT64XX5DPF,B0CTC25796,Must have,5.0,"March 27, 2025",Llenares,1,Lifted my eye area. Highly recommend!,0,2025-04-15 12:21:32
customer_review-R3FWAKPX7Y6WA1,B0CTC25796,Wow-great results,5.0,"February 13, 2025",Aly,1,"I read of this brand in news articles and read details of many Beauty of Joseon products on Amazon. Decided to try this eye cream and wow! so glad I did. I use a pea size amount at most under my eyes. I don’t have dark shadows but I can be puffy-wrinkly. Immediately I can see the change in texture. Just changes to smooth skin! No irritation, no scent, good amount of product in tube so well worth the reasonable price",10,2025-04-15 12:21:32
customer_review-R1OWHL6FKH1SBY,B0CTC25796,👍,5.0,"March 13, 2025",Vilma,1,Estés producto lo uso en todo el rostro y queda iluminado y elimina esa piel muerta qué no queremos . Es marabilloso.,0,2025-04-15 12:21:32
customer_review-RVD46HBMQ8I7W,B0CTC25796,Best eye cream/ gel ever,5.0,"March 26, 2025",Vivian K.,1,My skin feels very hydrated. I love it,0,2025-04-15 12:21:32
customer_review-R1LV7KRMM6YQ4A,B0CTC25796,Piel delicada en los ojos,5.0,"March 14, 2025",Amazon Customer,1,"Es una excelente opción nutritiva e hidratante para la zona de los ojos, especialmente en pieles maduras y secas.",0,2025-04-15 12:21:32
