review_id,asin,title,rating,date,reviewer_name,verified_purchase,body,helpful_count,crawl_date
customer_review-R2X0YAOLI9RJ03,B09DLFCB69,Amazing results,5.0,"December 6, 2024",L.Manzella,1,I have tried so many serums and this one is amazing! It lightened my dark spots and improved the texture of my skin. It absorbs into skin and works better than many more expensive products I have bought in the past. LOVE,7,2025-04-15 12:22:34
customer_review-R17581IO4Y1H7L,B09DLFCB69,Idk,5.0,"January 21, 2025",Fola,1,It was nice,0,2025-04-15 12:22:34
customer_review-R2J25DSL95EK5O,B09DLFCB69,Amazing Glow (super sensitive skin),5.0,"September 7, 2024",Amazon Customer,1,"Real buyer and reviewer here. I have super sensitive skin. I am on a STRICT routine with what I put on my face, and adding in new products extremely stresses me out as I used to deal with severe acne and had to go on accutane. This stuff has been amazing and given me the exact glow i have been wanting. I put my derma-e moisturizer, drunk elephant peptides and drunk elephant repair cream on first and rub that into my skin. Then i do just a small amount of this on top and rub in and it adds the glow!",17,2025-04-15 12:22:34
customer_review-R2GW96CX3SW4J3,B09DLFCB69,Works great,5.0,"October 13, 2024",Lisa,1,"I use this mostly on my underboob area where I've gotten discoloration over the years from sweating. It has lightened it very well with no irritation. I use it twice a day, in AM and PM. I also apply it to my face once a day where I have hyperpigmentation around my mouth and chin areas. I don't know if I see a difference on my face, but it doesn't irritate it and hopefully will see results after prolonged use.",9,2025-04-15 12:22:34
customer_review-R2TEWK0WC2XZ54,B09DLFCB69,So far so AWESOME,5.0,"April 3, 2024",Doodles21,1,"I’ve been using this product in conjunction with the Light on Serum. I use one in the morning one at night. It’s been a week and a half and wow. 🤩 I am amazed so far.
First right of the bat it improved the texture of my skin leaving it very soft.
I had no irritations which is great.
I tend to get these “allergic reaction pimples” and spent a lot of money on truly beauty for example just to have itchy pimple all over my forehead and other areas. This was the reason why I looked into something else, and more affordable too.
This fit the bill and worth a try.
And I am so glad I did.
No itchy pimples and after a week I can’t totally tell that it’s working.
I can see that my skin is brighter.
I never used this brand before and now u can’t wait to try other products.",20,2025-04-15 12:22:34
customer_review-R8YC4SOFTTEFH,B09DLFCB69,Best hydrating serum,5.0,"October 30, 2024",Amazon Customer,1,"I bought this serum several months ago but packed it away. I have started using it and with just two uses I see a real difference. It’s super hydrating and brightening, more than any serums I’ve used in the past. I don’t feel the need to add any other product except sunscreen during the day. I’m so glad I found it.",3,2025-04-15 12:22:34
customer_review-RB8TAY2IQY1Q9,B09DLFCB69,Perfect,5.0,"December 24, 2024",Zehra Akgul,1,"I’ve been using so many different brands but that is is the best! Even From first day, I can see the effect on my skin!",0,2025-04-15 12:22:37
customer_review-R2N0Z0AXSAHTZ7,B09DLFCB69,Difference,4.0,"August 26, 2024",Tee,1,"I just got my second bottle of Glow Deep Serum and it has totally different color, structure and smell.
I’m just wondering which one of those is fake!",17,2025-04-15 12:22:37
customer_review-R3S3SLZEQPB3RJ,B09DLFCB69,Meh,3.0,"November 4, 2024",MM,1,"Nice texture, no smell, nice to use but I have not seen any difference in my skin or how it looks after using the product for several weeks now. I do not use it consistently everyday, but I do most of days *(is because any other day I use Vitamin C only), 5 of 7 days a week, no visible change in the tone or texture of my skin. But feels like a nice product though, maybe works better on other types of skin, I'm Latina with clear skin, not so white but not brown.",2,2025-04-15 12:22:37
customer_review-R3Q5ZPG7HIGU5O,B09DLFCB69,hydrating glowy,4.0,"August 24, 2024",Ashley,1,I got it on a good sale and thought it was hydrating and glowy. I probably wouldn’t repurchase though bc there tons of cheaper serums that do the same thing.,7,2025-04-15 12:22:37
customer_review-R3CCK1MB0T83YD,B09DLFCB69,Works great,5.0,"October 14, 2024",Ny'Aja,1,"Adding this to my routine has been a game changer. It’s clearing dark spots that I’ve been trying to get rid of for months. I’m going on 3 weeks using it, and I still have some left. It really only takes like 3 or 4 drops for just face. I’ve been using it on more than just my face. It’s worth the money.",3,2025-04-15 12:22:37
customer_review-RILG6LJEH4P6C,B09DLFCB69,very good serum,5.0,"January 6, 2025",Alondra A.,1,This serum helped me achieve the glass skin I wanted!,0,2025-04-15 12:22:37
customer_review-R3J3E0IYB67CPG,B09DLFCB69,LYING ABOUT BLACK FRIDAY DEALS,3.0,"November 30, 2024",becca,1,"I purchased this over a month ago for $13.50
They're listing this as a black Friday deal for what, $11+ dollars saying the original price was over $17? Such a lie.

The product itself is subpar. It broke me out.
Though it did make my skin soft, it wasn't worth the underground acne I had to deal with after.",2,2025-04-15 12:22:37
customer_review-RD4T4J74BTFU8,B09DLFCB69,Really does not do much for an unreasonable price,2.0,"December 25, 2024",Pitt,1,"I bought this serum in hopes of helping my hyper pigmentation because of the alpha arbutin and the rice which supposedly has vitamin B or niacinamide for brightening effects, but this serum isn't as effective as I though it would be and even if it was effective you would run out before it could take effect (typically you have to use it for around 4-6 months for an effect), the bottle is so small that it would last you maybe a month of light daily use. It is not worth it for the price I bought at around 18? dollars or so. There are so many other better korean products for brightening skin at a better value. Also, the consistency is pretty thick and sticky which I didn't expect but will say wasn't too unpleasant. Also, it seems like it is pretty gentle/non irritating, but also be aware that if you do use the product, don't use it for too long because it is risky to use alpha arbutin for too long/more than 6 months",0,2025-04-15 12:22:37
customer_review-R2KJJUH8CFX65O,B09DLFCB69,Best skinare purchase I've made in years.,5.0,"May 24, 2024",Shannon,1,"I kept seeing this product on social media through influencers and thought it was going to just be another skincare product that I waste my money on. After a couple months I finally caved in and purchased it. I started using it 05/19 and its now 05/24. I use it every morning and night after cleansing my face. In these past 4/5 days I see a big difference in my skin. I've had no breakouts, no irritation, and my hyperpigmentation has lightened up a lot for just a few days. Aside from that my skin is glowing! People at work and friends have all complimented how great my skin. I know this sounds crazy but damn this is good! If you're going back and forth about this product GO FOR IT!",15,2025-04-15 12:22:37
customer_review-R1GX7YRBIC57JC,B09DLFCB69,good product,5.0,"November 5, 2024",j,1,i love this product. its improved my skin texture so much and keeps it moisturized even during cold dry weather. its lightweight and not sticky. bottle is a little small but it goes a long way and is worth the money.,0,2025-04-15 12:22:37
customer_review-R3O5X4O8GFTW5V,B09DLFCB69,Simply Amazing,5.0,"March 26, 2024",Tierra,1,"If you have dry skin, discoloration, and prefer a minimalistic approach to your skincare this is the product you’re looking for!

I bought this with the hope of clearing my hyperpigmentation and it did not disappoint! I’ve only been using it for 5 days twice a day and I’m already seeing results. My family even noticed and complimented my complexion.

My favorite things about it is that it doesn’t have any scent, it’s very lightweight, and gentle on my sensitive skin. For reference, I have eczema and this gives my face that dewy look I never thought I could achieve. Best of all, it’s the only product I’m currently using on my face. I tend to have breakouts if I use multiple skincare products so it’s important to have one thing that targets multiple issues. I simply wash my face with warm water, pat dry, and apply this serum.

Suffice to say, I’ve bought more of these so I never run out.",71,2025-04-15 12:22:40
customer_review-R24Y3AS3M57NTX,B09DLFCB69,Glow,5.0,"January 2, 2025",AM,1,Moisturizing lightweight not sticky and hydrates,0,2025-04-15 12:22:40
customer_review-R29EPGTFKIO34G,B09DLFCB69,All good,5.0,"January 12, 2025",Raúl Rodriguez,1,All good,0,2025-04-15 12:22:40
customer_review-R1DE9X5FAS8TUI,B09DLFCB69,Perfect!!!,5.0,"November 22, 2024",Maram,1,"It’s the second time I order it and I’m very satisfied!! It moisturizes my skin, makes it glow and the most important thing for me that it’s lightweight and good for my skin",4,2025-04-15 12:22:40
customer_review-R1DHIWX6IV6JYH,B09DLFCB69,Don't expect quick results.,4.0,"July 20, 2024",Lynda,1,"This product reduced the age spots on my arms and hands. However, it's very slow and I have to use it religiously every morning and evening. You will see a lightening of the skin.",2,2025-04-15 12:22:40
customer_review-R14Q6DIVDBBRAE,B09DLFCB69,Get this NOW,5.0,"November 22, 2024",HMJ,1,This stuff works. Found about it on TikTok but this is far from a gimmick. Clearing my dark marks like no other product has. Truly,2,2025-04-15 12:22:40
customer_review-R2GKFKZK1NVTS2,B09DLFCB69,Quality,4.0,"September 10, 2024",Waqas,1,Not the same,0,2025-04-15 12:22:40
customer_review-R315IJMO3J01MT,B09DLFCB69,Must have,5.0,"October 14, 2024",Dalya Jameel,1,"Just like the other serum of Beauty of Joseon Glow Deep. It does leave the skin glowing and soft, I feel like the price should be a bit less but I got it on sale. No scent to it. Highly recommended for fast results",5,2025-04-15 12:22:40
customer_review-R2L2BDRS7D8NR8,B09DLFCB69,Works great!,5.0,"December 5, 2024",Bleenders,1,Hyperpigmentation is fading! This stuff works well and feels great on the skin.,3,2025-04-15 12:22:40
customer_review-R1HS7Y6JS1ENFN,B09DLFCB69,Seems fine,4.0,"August 14, 2024",MO,1,Did not irritate skin. Might be slightly minimizing my dark spots. Feels nice.,6,2025-04-15 12:22:40
