review_id,asin,title,rating,date,reviewer_name,verified_purchase,body,helpful_count,crawl_date
customer_review-R38QL8ML4VFFR1,B0CTC25796,More than just an eye cream,5.0,"February 24, 2025",Tamara,1,"This cream works great under my eyes, but I am 68yrs old and my hands are starting to show it. I started applying this cream to the back of my hands a couple of times a day and it works miracles! My hands look so soft and smooth, game changer. Try it!",3,2025-04-15 12:21:32
customer_review-R1DZREW4XBJQ4W,B0CTC25796,It is okay.,4.0,"January 29, 2025",Kindle Customer,1,"This feels nice on skin and seems to be good quality in feel of cream, but I didn't notice a I've difference after finishing tube. Didn't irritate skin, so that is nice!",2,2025-04-15 12:21:32
customer_review-RLLSM8W5P871E,B0CTC25796,Me hidrata súper bien,5.0,"March 15, 2025",Migliana,1,"Todo lo que sea coreano me encanta , y esta cremita hidratante para las la zona de ojeras es excelente",0,2025-04-15 12:21:32
customer_review-R4VTDZUTUS0QF,B0CTC25796,I've repurchased 7x,5.0,"January 19, 2025",Lara,1,Found this product thru Youtube's Dr. Dray - I purchased first time bc of her recommendation and affordable price. I noticed my under eye area started getting dry crepe/wrinkly and hoped this would help! My under eyes are so incredibly smooth now - I use morning and night - I tap a bit of water first then the product. I let fully dry in the morning then use a sunscreen color corrector over top. I have used different concealers all with the same smooth result. I don't use powders under my eyes - don't need to. I don't go crazy with the amount but don't skimp either. I have had very sensitive eyes - with full blown eczema - so I'm careful. I've never had any negative reaction.,2,2025-04-15 12:21:33
customer_review-R2UAD2QE61OVIQ,B0CTC25796,Good choice,5.0,"February 27, 2025",Tricia,1,"Love this eye cream, a little goes a long way. I had eye bags and hollowing, I have been using this for about a month, and I have seen a vast difference. Lifestyle changes will also help. Great value.",0,2025-04-15 12:21:33
customer_review-R3AP269LG933VM,B0CTC25796,It works !,5.0,"February 9, 2025",Sam,1,"To be honest I never seen results to eye creams ever. But since I was determined to take care of my skin and really make sure i did am and pm facial care , I noticed huge difference.
I am 33 y.o and here is 10 days difference in same light with the same smile. I’m impressed at difference that it makes, it takes half a pump to moisturize both eyes and I would love to see more changes around my eyes!
( my skin tone improved due to medik8 C serum )",36,2025-04-15 12:21:35
customer_review-R3JV0KIYWSOCQZ,B0CTC25796,Love it!,5.0,"March 20, 2025",Cliente Amazon,1,Very nice formula and price. I will repurchase,0,2025-04-15 12:21:35
customer_review-R3VUR108MSZRC4,B0CTC25796,"I’ve been let down by so many eye creams, but this one finally impressed me.",5.0,"October 10, 2024",Gina Arnone,1,"Finding an eye serum that delivers real results without costing a fortune has been a journey, but Beauty of Joseon Revive Eye Serum has really impressed me. I was starting to think only high-end creams or simple options like CeraVe could do the job, but this serum handles everything I need—puffiness, dark circles, and fine lines—while remaining budget-friendly.

The serum has a lightweight consistency that absorbs quickly, and I really appreciate how it doesn’t leave a sticky residue. It feels refreshing around the eyes and layers beautifully under makeup without causing any pilling, which is a must for me. I love the combination of ginseng and retinal, which work together to hydrate and smooth the skin. Ginseng provides that deep hydration and elasticity boost, while retinal gently improves texture and firmness. It’s great that the retinal is in liposome form, so it’s more stable and less likely to cause irritation compared to traditional retinol.

What’s also great about this product is the size. A lot of eye creams come in tiny amounts that you burn through in no time, but this one gives you a more generous portion. I also like that it’s gentle enough for daily use and even works well for those with sensitive skin, like me. Over time, I’ve noticed a real improvement in how smooth and bright my under-eye area looks, which I haven’t found with many other products.

Final Thoughts
If you’re looking for an affordable yet effective eye serum, the Beauty of Joseon Revive Eye Serum is worth trying. It handles puffiness, dark circles, and fine lines without breaking the bank, and the combination of ginseng and retinal is great for long-term skin health. I’m really happy with the results so far, and it’s refreshing to find an eye product that actually works for me.",91,2025-04-15 12:21:35
customer_review-R3BUNAJFJ3WRCA,B0CTC25796,Broken pump..,4.0,"September 27, 2024",Sincerely Kristen,1,"After reading all the reviews, I decided to try ordering this anyway. I too, received this with a broken pump. They need to rethink the bottle/tube design. Totally bummed about that, but I don’t feel like waiting to have another sent or waiting on ordering the comparable item that was in the running. I’ve only been using it for a few days and have had no adverse reaction/sensitivity, so far. I did it one off and one on for the first 2 times and then switched to using it every night. It’s a little inconvenient to remove the cap and squeeze to dispense, as it is not designed to do that. This seems to be a good starter retinol, so I’ll try it and see how it does. I don’t find it to be greasy or to have any unpleasant or heavy fragrance. Now, time will tell..",2,2025-04-15 12:21:35
customer_review-R1BLM5B5COHT0M,B0CTC25796,Love the eye cream!!!,5.0,"March 8, 2025",Linda Lou,1,This is awesome. I read about it somewhere and ordered it. I have told others about it.,0,2025-04-15 12:21:35
customer_review-R1EJ6DUWTKQUWF,B0CTC25796,Decent product,4.0,"January 25, 2025",JMc,1,Good product and works well under makeup. The item is affordable which explains why there isn't much in the tube.,0,2025-04-15 12:21:35
customer_review-R2MH7HCTJPJK0I,B0CTC25796,hydrates nicely,4.0,"January 31, 2025",Lisa,1,Hydrates nicely. I really like the Korean brands and this didn't disappoint.,0,2025-04-15 12:21:35
customer_review-R2P578PLE6GQOV,B0CTC25796,Muy bueno,5.0,"March 14, 2025",Natalia Alfaro,1,"Es un buen producto, me gusta este que trae dos unidades. Aún debo utilizarlo por más tiempo",0,2025-04-15 12:21:35
customer_review-R10PJ535ELU1UN,B0CTC25796,First time,4.0,"January 12, 2025",teresa,1,I tried this and have seen a change but my eyes are tired looking so maybe I will apply a little more two times a day,0,2025-04-15 12:21:35
customer_review-R2BFGWGAN3V5QC,B0CTC25796,I like my face better,4.0,"June 28, 2024",Taylor,1,"I’m at the age now where I need to take my skin care more seriously and have creams and serums. I’m always hesitant to use eye creams because I hadn’t found one that actually worked. Until I decided to take a gamble and try this one, which I saw talked about on TikTok…I am so happy with my purchase!
I am already very pleased with the results and I have not even been good at staying on a consistent schedule using it!
I use it at night before going to bed. I squeeze like a half pea size for each eye. A little goes along way because it is so smooth, easy to apply, and absorbs amazingly. Because it does have some retinal in it, and my under eyes can be sensitive to retinal mixing with other ingredients, I find the best time for me to apply is at night. I wake up to such moisturized and even looking skin under my eyes in the morning. Ugh, I’m in love. Like I said, it makes me like my face better haha I also like that it doesn’t have a scent - or at least not one that I can smell.
The only thing keeping me from giving it 5 stars is that my pump doesn’t work and hasn’t since I got it. I have to unscrew the cap to get the product out.",162,2025-04-15 12:21:35
customer_review-R12YHSOVSPNT52,B0CTC25796,it might work?,4.0,"December 23, 2024",keyana,1,"not really sure if this worked for me, when pairing this with brightening toners/serums i started seeing changes- but i did only use this eye cream by itself for 2 weeks.
the product itself isn’t sticky, it’s lightweight, easy to
use, and i do think it helped my little wrinkle i had when i smile lol.",13,2025-04-15 12:21:38
customer_review-RPE9MZXQYMQDN,B0CTC25796,Love this product!,5.0,"February 19, 2025",Tiffany Sofia,1,"My skin has never looked better than when I started using Beauty of Joseon products! My skin looks brighter, hydrated and healthier. This specific product has helped rid the darkness from my under eyes so much! Highly recommend.",0,2025-04-15 12:21:38
customer_review-R3IYBVIZCWSWDU,B0CTC25796,Patience,4.0,"December 7, 2024",Carolina Delgado,1,"I loved this product. You have to be consistent. I’ve tried so many eye creams and nothing seemed to work. A co worker told me about this skin brand so I figured I’d give it a try and I’m so glad I did. Works really good, lightened up the appearance of my under eye lines. 10/10 recommend. Just be patient.",2,2025-04-15 12:21:38
customer_review-R5Q1GTTY2BCMT,B0CTC25796,Love it,5.0,"February 14, 2025",Hoaiphuong Tang,1,"This ice cream is really good. It makes my eyes feels like it’s rejuvenating. It feels like you know it’s getting rid of my black and my dark eyes because I’ll be having so much of that cause I don’t get enough sleep, but this really helps me a lot.",0,2025-04-15 12:21:38
customer_review-RFP71OK174J44,B0CTC25796,does help puffiness!,4.0,"December 30, 2024",kay,1,"it's pretty good, takes a while to see noticeable results & it did not help the darkness in my eyebags but it made them a LOT less puffy. def reccomend for that",0,2025-04-15 12:21:38
customer_review-RN0V03471L0CS,B0CTC25796,Love,5.0,"March 20, 2025",KINYET,1,Great product,0,2025-04-15 12:21:38
customer_review-R271FY13K9GPBF,B0CTC25796,Amazing product!!,4.0,"September 11, 2024",Hsu,1,"Bought this on Prime day and absolutely fell in love with it. It’s lightweight, easy to absorb, fragrance-free. I saw noticeable change the next day, under eye wrinkles got smoother. I have used other k beauty brands as well but this one is my fav eye cream so far. One thing I haven’t seen mentioned in the review section so it might just be me but my eyelashes grew longer as well. I have very short eyelashes that i normally can’t curl them and have tried eyelash serum but it caused my eyelid to be darkened so i stopped using those. I wasn’t even purposely rubbing this on my eyelashes but it just came in contact with the cream i apply under my eyes and after 1 week i have long enuf eyelashes to curllll !!! Yayyyy !!!
Gave it 4 stars just because it came a little damaged… but quality wise, amazinggggg <3",5,2025-04-15 12:21:38
customer_review-R33BRQPYVY5IVW,B0CTC25796,Excellent eye cream!,5.0,"February 6, 2025",Melina,1,"This eye cream is super hydrating without feeling too heavy. I’ve used other eye creams that will pill throughout the day when other products like makeup are applied on top, which this one doesn’t do. Also fairly cheap for how much product you get. This is a better deal than the elf eye cream which is about $11 but you don’t get half as much!",0,2025-04-15 12:21:38
customer_review-R4Z6NFSORTCQG,B0CTC25796,Best eye brightening,5.0,"March 16, 2025",austin jackson,1,Best dark circle brightener on the market!,0,2025-04-15 12:21:38
customer_review-RXKQPX1J514HE,B0CTC25796,Good cream,5.0,"February 17, 2025",Char,1,This eye cream is good for dark circles and I like how it features a pump. This cream lasts a long time and is very effective. I use it morning and night and have had it for over 3 months. I would recommend!,0,2025-04-15 12:21:38
customer_review-R3UD8F6JGDM2O0,B0CTC25796,"An awesome ""serum"" that feels more like an eye cream",5.0,"January 3, 2025",j32flavors,1,"After I developed a handful of annoying milia bumps on my face, I revamped my skincare routine, which entails using only products that are non-pore–clogging (different from non-comedogenic!). A dermatologist recommended this eye cream for its moisturizing and non-pore–clogging abilities. She actually said while it was an eye cream, you could use on your whole face. I use one pump on my whole face morning and night

I don't know if it's the eye cream or the whole skincare revamp, but I've gotten a ridiculous amount of compliments on my skin. Two separate friends I hadn't seen in a couple of months asked me to send them instructions to my regimen! I chalk it up to three things: this eye cream for sure; Naked and Thriving's Renew night serum; and finishing my skincare routine with pure squalane oil to lock in the treatments.

This eye cream is a keeper for me. It's reasonably priced, feels really good on my skin, and it doesn't cause me any milia problems. I recommend it!",44,2025-04-15 12:21:40
customer_review-R3OIUNDNO6BRBS,B0CTC25796,best,5.0,"March 8, 2025",Yary C,1,"this product is the love of my life! creamy, smooth and hydrating.",0,2025-04-15 12:21:40
customer_review-RUQ79S5R6KILL,B0CTC25796,will buy again,5.0,"February 17, 2025",kel,1,Been using this for months now and I do see a difference under my eyes. I use it every night and will most likely stick to this under eye cream. It does not break me out either which is nice.,0,2025-04-15 12:21:40
customer_review-R2IZGU3UNL5MVE,B0CTC25796,Noticeable Difference,5.0,"February 15, 2025",Hemali,1,"This is the first eye cream I’ve ever used, and I’m genuinely impressed by the results. After just two weeks of consistent use, I’ve noticed a visible difference - my under-eye area looks brighter, and my skin feels deeply hydrated. As someone with dry skin, finding a product that provides lasting moisture has always been a challenge, but this cream has been a game-changer!",45,2025-04-15 12:21:40
customer_review-R3VE0DCMHFG2M0,B0CTC25796,Light weight hydrating,5.0,"February 27, 2025",Sylvia,1,"5 stars! This under eye cream was gentle, hydrating, and my skin felt smoother within the first week. Just a small amount under and around eye daily.",0,2025-04-15 12:21:40
customer_review-R3EUIUREDE5NH5,B0CTC25796,It Works!,5.0,"March 5, 2025",Ariamna,1,"Really Works! Just twice and my bags under my eyes disappear. skin brightness, hydration, skin softness, and good scent.",0,2025-04-15 12:21:40
customer_review-R2YB0R8WKYLW4I,B0CTC25796,Viral products,3.0,"March 28, 2025",Paula,1,"The Beauty of Joseon Revive Eye Serum is a decent eye cream with ginseng and retinol. It feels light on the skin and helps with fine lines, but it might take time to show results. Some people may find it a bit drying at first. Good for beginners, but not a miracle product!",0,2025-04-15 12:21:40
customer_review-R2SUYUH5MSDM4J,B0CTC25796,Insatisfacción,5.0,"March 12, 2025",Mayra Nohemy Rodríguez Narváez,1,"Muy buena calidad,pero el frasco me vino casi vacio",0,2025-04-15 12:21:40
customer_review-R2N9J0CC36WM4Q,B0CTC25796,Noticeable improvements!,5.0,"November 20, 2024",Amazon Customer,1,"I’m so impressed with this eye cream. I heard about it from Dr. Dray on YouTube. I have sensitive skin and many eye creams cause the creases around my eyes to split open and become red, sore cuts that take ages to heal. This cream has not caused any negative reactions at all. I did start slow, twice a week at first, but now use it nightly with no problems. The skin under my eyes has definitely improved; the texture is better and fine under-eye wrinkles have practically disappeared. I do have some crows feet/smile lines that I don’t expect to disappear, but they seem less pronounced. And those annoying little milia bumps have gone away. I honestly never expected to see noticeable results like this. FYI I’m 52 and have been using it nightly for a month, and plan to continue doing so as long as it’s available!",8,2025-04-15 12:21:40
customer_review-R2BTYCIL78QCHX,B0CTC25796,Nice,4.0,"November 23, 2024",Jiya,1,"This product is really nice and softens your skin, it’s a great product for hydration, brightness your skin as well, product is lightweight as well, yet I was expecting the product to be a bit bigger in size.",0,2025-04-15 12:21:40
customer_review-R3UG29U2X4B9Z1,B0CTC25796,Korean face products,5.0,"March 10, 2025",Kristin kutcher,1,Korean product. I like Korean products,0,2025-04-15 12:21:42
customer_review-R36RTSSHYZYVI2,B0CTC25796,Muy bueno,5.0,"March 3, 2025",María Fernanda mojica,1,"Este contorno de ojos es realmente bueno.
Lo uso dos veces al dia y mis ojos estan radiantes! Lo recomiendo",0,2025-04-15 12:21:42
customer_review-R3IDNYXUZEDXR9,B0CTC25796,Works well,5.0,"March 1, 2025",lisa burroughs,1,I have gotten good results. I had clogged pores above my eye. This has resolved the issue while leaving eyes toned.,0,2025-04-15 12:21:42
customer_review-R3HCVIYETVOUPF,B0CTC25796,honest review,5.0,"October 16, 2024",Phil,1,"This stuff is magical and the bottle size is perfect because you don’t need a lot of cream for under your eyes. This size will literally last months. I’ve only used this for 3 days but I’ve already noticed a difference. I don’t get paid for my reviews so this is an honest one haha.

My under eyes are ALWAYS dark like no matter how much sleep I get. These brightened me up better than anything I’ve ever used and it worked so fast too. I notified a difference the next day.

My under eyes feel super soft and hydrated and the best part is the cream is lightweight and rubs in nicely so it doesn’t feel like you have heavy goop under your eyes. Sometimes other under eye cream can feel heavy.

I have semi-sensitive skin too and this stuff was perfectly fine for me. By sensitive, I mean I usually get one or two random pimples if I try anything new and my skin doesn’t like it. My skin usually knows whether it likes something or not after the first day. I’m on day 3 and we’re going strong so I’m happy! Get this stuff!",60,2025-04-15 12:21:42
customer_review-RP6DSDSC367G2,B0CTC25796,It is the best eye cream at the best price!,5.0,"January 24, 2025",Maggie,1,"I love the way it goes on, it is so silky and smooth. I just tap a little on under my eye towards the outer
corner. I instantly see my wrinkles and laugh lines diminish! What I like most of all is, it does not roll off when I put my foundation on! That would definitely be a deal breaker for me because if it rolls off what good is it? I absolulutely love the way it moisturizes and reduces and diminishes my laugh lines. It is the first thing I put on morning and night!",7,2025-04-15 12:21:43
customer_review-RUKVPYAMVRHEW,B0CTC25796,No tube inside for pump mechanism,4.0,"October 10, 2024",Trang Vu,1,"The product inside is great! I have used it for a few days now and notice that the skin around my eyes is brighter and smoother. The product doesn’t have a smell which is great, glides on so you aren’t pulling at your skin, is not greasy and you can feel it absorb into the skin. I deducted one star because it’s a pump, but there’s no tube inside to suck up the product. I have to open the top and squeeze out the product each time I use it. Overall, I will buy this product again.",10,2025-04-15 12:21:43
customer_review-RYIMP2UYJP747,B0CTC25796,Safe useful product,5.0,"March 4, 2025",Margo,1,Very safe close shave still used razor but will keep didn’t cut skin very good,0,2025-04-15 12:21:43
customer_review-RAD26QC9YEYSI,B0CTC25796,MY FAVORITE EYE CREAM!,5.0,"March 23, 2025",Styled.by.Al,1,,12,2025-04-15 12:21:43
customer_review-R3R1CK8VDSYANC,B0CTC25796,Llegó debidamente sellada,5.0,"March 12, 2025",Llego antes excelente,1,Voy a ensayarlo espero que me funcione,0,2025-04-15 12:21:43
customer_review-RWRF6AQ3XO0XI,B0CTC25796,Good product 10 of 10,5.0,"February 22, 2025",MR,1,Best products .. so glad I got ..texture nice it’s wort for the price ..,0,2025-04-15 12:21:43
